[
  {
    "schemaVersion": 1,
    "kind": "compiler",
    "status": "passed",
    "sourceDigest": "3f22afdd45513ac6819f0be2562a3525f5971265cd4de22f183c607d3ced2431",
    "generatorDigest": "b6664f483ba51882e81ccb44bccbd2f99d8b94f74ce58f5bb10297209fa7c196",
    "configurationDigest": "4b5d1204a620cea10ca6e8253e7e68dd9677d9be73bacac4271126898ce95400",
    "fixtureDigest": "e81e5fdbbf8203d148e3c70e958cd40b14ccc95de6541b60b000d2d7a195959c",
    "profile": "profile:apex261-ut261-mmd3102",
    "tool": "SQLcl: Release 26.1.2.0 Production Build: 26.1.2.132.1334; MMD 26.1.0+3102",
    "runner": "local",
    "timestamp": "2026-09-29T17:58:15.028028+00:00",
    "artifacts": [
      "docs/evidence/composer-local.json"
    ],
    "reason": "Real offline SQLcl validation of complete crm fixture containing this block. No live SQL, import, DML or browser qualification."
  }
]
